{"contract_version":"1.0","coordinate_system":"local_enu_m","duration_ms":15000,"environment":{"terrain":"urban","time_of_day":"night","weather":"rain"},"generator_version":"1.0.0","profile":{"difficulty":3,"profile_id":"demo-night-degraded","skill_tags":["detection","classification","assessment","response"]},"scenario_id":"scenario-v1-c7f744d680aa3842","seed":2624703,"targets":[{"affiliation":"simulated_threat","entity_class":"uas","t_visible_ms":6000,"target_id":"threat-01","trajectory":[{"altitude_m":126,"t_ms":0,"x_m":-623.522,"y_m":-1045.293},{"altitude_m":126,"t_ms":1000,"x_m":-525.43,"y_m":-911.672},{"altitude_m":126,"t_ms":2000,"x_m":-428.371,"y_m":-777.776},{"altitude_m":126,"t_ms":3000,"x_m":-336.634,"y_m":-639.438},{"altitude_m":126,"t_ms":4000,"x_m":-253.105,"y_m":-495.001},{"altitude_m":126,"t_ms":5000,"x_m":-176.504,"y_m":-345.863},{"altitude_m":126,"t_ms":6000,"x_m":-103.465,"y_m":-195.253},{"altitude_m":126,"t_ms":7000,"x_m":-31.19,"y_m":-45.888},{"altitude_m":126,"t_ms":8000,"x_m":41.806,"y_m":101.311},{"altitude_m":126,"t_ms":9000,"x_m":115.772,"y_m":246.968},{"altitude_m":126,"t_ms":10000,"x_m":190.26,"y_m":392.275},{"altitude_m":126,"t_ms":11000,"x_m":264.738,"y_m":538.142},{"altitude_m":126,"t_ms":12000,"x_m":338.944,"y_m":684.868},{"altitude_m":126,"t_ms":13000,"x_m":412.919,"y_m":832.269},{"altitude_m":126,"t_ms":14000,"x_m":486.833,"y_m":979.97},{"altitude_m":126,"t_ms":15000,"x_m":560.821,"y_m":1127.668}]},{"affiliation":"simulated_threat","entity_class":"uas","t_visible_ms":7000,"target_id":"threat-02","trajectory":[{"altitude_m":164,"t_ms":0,"x_m":-448.005,"y_m":-1092.021},{"altitude_m":164,"t_ms":1000,"x_m":-389.006,"y_m":-946.261},{"altitude_m":164,"t_ms":2000,"x_m":-333.678,"y_m":-800.812},{"altitude_m":164,"t_ms":3000,"x_m":-275.73,"y_m":-654.95},{"altitude_m":164,"t_ms":4000,"x_m":-209.156,"y_m":-508.323},{"altitude_m":164,"t_ms":5000,"x_m":-134.367,"y_m":-360.991},{"altitude_m":164,"t_ms":6000,"x_m":-55.845,"y_m":-213.672},{"altitude_m":164,"t_ms":7000,"x_m":22.516,"y_m":-66.968},{"altitude_m":164,"t_ms":8000,"x_m":98.929,"y_m":79.135},{"altitude_m":164,"t_ms":9000,"x_m":173.47,"y_m":225.043},{"altitude_m":164,"t_ms":10000,"x_m":247.114,"y_m":371.174},{"altitude_m":164,"t_ms":11000,"x_m":320.781,"y_m":517.747},{"altitude_m":164,"t_ms":12000,"x_m":394.866,"y_m":664.763},{"altitude_m":164,"t_ms":13000,"x_m":469.271,"y_m":812.097},{"altitude_m":164,"t_ms":14000,"x_m":543.696,"y_m":959.594},{"altitude_m":164,"t_ms":15000,"x_m":617.913,"y_m":1107.133}]},{"affiliation":"simulated_threat","entity_class":"uas","t_visible_ms":7000,"target_id":"threat-03","trajectory":[{"altitude_m":163,"t_ms":0,"x_m":-551.007,"y_m":-1124.691},{"altitude_m":163,"t_ms":1000,"x_m":-476.527,"y_m":-977.173},{"altitude_m":163,"t_ms":2000,"x_m":-399.323,"y_m":-826.434},{"altitude_m":163,"t_ms":3000,"x_m":-321.002,"y_m":-678.006},{"altitude_m":163,"t_ms":4000,"x_m":-244.366,"y_m":-534.402},{"altitude_m":163,"t_ms":5000,"x_m":-170.032,"y_m":-394.574},{"altitude_m":163,"t_ms":6000,"x_m":-96.679,"y_m":-254.904},{"altitude_m":163,"t_ms":7000,"x_m":-23.051,"y_m":-112.329},{"altitude_m":163,"t_ms":8000,"x_m":51.286,"y_m":33.848},{"altitude_m":163,"t_ms":9000,"x_m":126.108,"y_m":182.429},{"altitude_m":163,"t_ms":10000,"x_m":200.974,"y_m":331.67},{"altitude_m":163,"t_ms":11000,"x_m":275.561,"y_m":480.338},{"altitude_m":163,"t_ms":12000,"x_m":349.789,"y_m":628.044},{"altitude_m":163,"t_ms":13000,"x_m":423.758,"y_m":775.032},{"altitude_m":163,"t_ms":14000,"x_m":497.632,"y_m":921.775},{"altitude_m":163,"t_ms":15000,"x_m":571.531,"y_m":1068.654}]},{"affiliation":"non_hostile","entity_class":"balloon","t_visible_ms":8000,"target_id":"clutter-01","trajectory":[{"altitude_m":203,"t_ms":0,"x_m":-647.469,"y_m":970.522},{"altitude_m":203,"t_ms":1000,"x_m":-581.786,"y_m":870.381},{"altitude_m":203,"t_ms":2000,"x_m":-507.871,"y_m":762.007},{"altitude_m":203,"t_ms":3000,"x_m":-432.81,"y_m":652.486},{"altitude_m":203,"t_ms":4000,"x_m":-371.867,"y_m":557.084},{"altitude_m":203,"t_ms":5000,"x_m":-294.771,"y_m":445.53},{"altitude_m":203,"t_ms":6000,"x_m":-232.344,"y_m":348.643},{"altitude_m":203,"t_ms":7000,"x_m":-162.58,"y_m":244.42},{"altitude_m":203,"t_ms":8000,"x_m":-94.792,"y_m":142.173},{"altitude_m":203,"t_ms":9000,"x_m":-28.626,"y_m":41.548},{"altitude_m":203,"t_ms":10000,"x_m":48.35,"y_m":-69.886},{"altitude_m":203,"t_ms":11000,"x_m":115.433,"y_m":-171.429},{"altitude_m":203,"t_ms":12000,"x_m":179.909,"y_m":-270.364},{"altitude_m":203,"t_ms":13000,"x_m":261.146,"y_m":-386.06},{"altitude_m":203,"t_ms":14000,"x_m":327.977,"y_m":-487.35},{"altitude_m":203,"t_ms":15000,"x_m":371.321,"y_m":-565.153}]},{"affiliation":"non_hostile","entity_class":"balloon","t_visible_ms":8000,"target_id":"clutter-02","trajectory":[{"altitude_m":264,"t_ms":0,"x_m":1248.812,"y_m":-556.819},{"altitude_m":264,"t_ms":1000,"x_m":1092.777,"y_m":-474.597},{"altitude_m":264,"t_ms":2000,"x_m":975.831,"y_m":-431.463},{"altitude_m":264,"t_ms":3000,"x_m":843.487,"y_m":-372.932},{"altitude_m":264,"t_ms":4000,"x_m":701.175,"y_m":-304.432},{"altitude_m":264,"t_ms":5000,"x_m":573.668,"y_m":-250.738},{"altitude_m":264,"t_ms":6000,"x_m":444.183,"y_m":-195.066},{"altitude_m":264,"t_ms":7000,"x_m":314.067,"y_m":-138.762},{"altitude_m":264,"t_ms":8000,"x_m":182.004,"y_m":-80.511},{"altitude_m":264,"t_ms":9000,"x_m":52.037,"y_m":-24.357},{"altitude_m":264,"t_ms":10000,"x_m":-80.321,"y_m":34.188},{"altitude_m":264,"t_ms":11000,"x_m":-218.215,"y_m":98.269},{"altitude_m":264,"t_ms":12000,"x_m":-355.503,"y_m":161.745},{"altitude_m":264,"t_ms":13000,"x_m":-477.554,"y_m":209.983},{"altitude_m":264,"t_ms":14000,"x_m":-614.177,"y_m":272.794},{"altitude_m":264,"t_ms":15000,"x_m":-728.951,"y_m":313.756}]},{"affiliation":"non_hostile","entity_class":"bird","t_visible_ms":8000,"target_id":"clutter-03","trajectory":[{"altitude_m":259,"t_ms":0,"x_m":671.657,"y_m":-1046.639},{"altitude_m":259,"t_ms":1000,"x_m":573.0,"y_m":-907.984},{"altitude_m":259,"t_ms":2000,"x_m":514.844,"y_m":-809.83},{"altitude_m":259,"t_ms":3000,"x_m":454.304,"y_m":-709.292},{"altitude_m":259,"t_ms":4000,"x_m":376.844,"y_m":-591.834},{"altitude_m":259,"t_ms":5000,"x_m":303.705,"y_m":-478.697},{"altitude_m":259,"t_ms":6000,"x_m":234.705,"y_m":-369.698},{"altitude_m":259,"t_ms":7000,"x_m":166.263,"y_m":-261.259},{"altitude_m":259,"t_ms":8000,"x_m":96.206,"y_m":-151.203},{"altitude_m":259,"t_ms":9000,"x_m":26.632,"y_m":-41.631},{"altitude_m":259,"t_ms":10000,"x_m":-38.591,"y_m":63.59},{"altitude_m":259,"t_ms":11000,"x_m":-111.217,"y_m":176.214},{"altitude_m":259,"t_ms":12000,"x_m":-174.036,"y_m":279.031},{"altitude_m":259,"t_ms":13000,"x_m":-243.839,"y_m":388.832},{"altitude_m":259,"t_ms":14000,"x_m":-322.842,"y_m":507.833},{"altitude_m":259,"t_ms":15000,"x_m":-382.152,"y_m":607.142}]}],"time_step_ms":1000}
