{"contract_version":"1.0","coordinate_system":"local_enu_m","duration_ms":12000,"environment":{"terrain":"abstract_flat","time_of_day":"day","weather":"clear"},"generator_version":"0.1.0","profile":{"difficulty":1,"profile_id":"demo-scripted-clear","skill_tags":["detection","classification","assessment","response"]},"scenario_id":"scenario-eda575b2f0000602","seed":2624701,"targets":[{"affiliation":"simulated_threat","entity_class":"uas","t_visible_ms":4000,"target_id":"target-01","trajectory":[{"altitude_m":145,"t_ms":0,"x_m":-1217.847,"y_m":272.678},{"altitude_m":145,"t_ms":1000,"x_m":-1014.872,"y_m":227.232},{"altitude_m":145,"t_ms":2000,"x_m":-811.898,"y_m":181.786},{"altitude_m":145,"t_ms":3000,"x_m":-608.923,"y_m":136.339},{"altitude_m":145,"t_ms":4000,"x_m":-405.949,"y_m":90.893},{"altitude_m":145,"t_ms":5000,"x_m":-202.974,"y_m":45.446},{"altitude_m":145,"t_ms":6000,"x_m":-0.0,"y_m":0.0},{"altitude_m":145,"t_ms":7000,"x_m":202.974,"y_m":-45.446},{"altitude_m":145,"t_ms":8000,"x_m":405.949,"y_m":-90.893},{"altitude_m":145,"t_ms":9000,"x_m":608.923,"y_m":-136.339},{"altitude_m":145,"t_ms":10000,"x_m":811.898,"y_m":-181.786},{"altitude_m":145,"t_ms":11000,"x_m":1014.872,"y_m":-227.232},{"altitude_m":145,"t_ms":12000,"x_m":1217.847,"y_m":-272.678}]}],"time_step_ms":1000}
