{"contract_version":"1.0","coordinate_system":"local_enu_m","duration_ms":15000,"environment":{"terrain":"rural","time_of_day":"day","weather":"clear"},"generator_version":"1.0.0","profile":{"difficulty":2,"profile_id":"demo-swarm-rural","skill_tags":["detection","classification","assessment","response"]},"scenario_id":"scenario-v1-3ff82f753436dd56","seed":2624702,"targets":[{"affiliation":"simulated_threat","entity_class":"uas","t_visible_ms":4000,"target_id":"threat-01","trajectory":[{"altitude_m":200,"t_ms":0,"x_m":-106.417,"y_m":1136.647},{"altitude_m":200,"t_ms":1000,"x_m":-91.555,"y_m":974.188},{"altitude_m":200,"t_ms":2000,"x_m":-74.317,"y_m":812.766},{"altitude_m":200,"t_ms":3000,"x_m":-54.542,"y_m":648.381},{"altitude_m":200,"t_ms":4000,"x_m":-33.982,"y_m":480.245},{"altitude_m":200,"t_ms":5000,"x_m":-14.47,"y_m":310.367},{"altitude_m":200,"t_ms":6000,"x_m":2.809,"y_m":140.925},{"altitude_m":200,"t_ms":7000,"x_m":17.798,"y_m":-27.429},{"altitude_m":200,"t_ms":8000,"x_m":31.553,"y_m":-195.338},{"altitude_m":200,"t_ms":9000,"x_m":45.322,"y_m":-363.567},{"altitude_m":200,"t_ms":10000,"x_m":59.778,"y_m":-532.392},{"altitude_m":200,"t_ms":11000,"x_m":74.912,"y_m":-701.62},{"altitude_m":200,"t_ms":12000,"x_m":90.335,"y_m":-870.857},{"altitude_m":200,"t_ms":13000,"x_m":105.679,"y_m":-1039.82},{"altitude_m":200,"t_ms":14000,"x_m":120.809,"y_m":-1208.483},{"altitude_m":200,"t_ms":15000,"x_m":135.796,"y_m":-1377.007}]},{"affiliation":"simulated_threat","entity_class":"uas","t_visible_ms":4000,"target_id":"threat-02","trajectory":[{"altitude_m":186,"t_ms":0,"x_m":-59.213,"y_m":1244.143},{"altitude_m":186,"t_ms":1000,"x_m":-47.295,"y_m":1065.791},{"altitude_m":186,"t_ms":2000,"x_m":-34.626,"y_m":888.221},{"altitude_m":186,"t_ms":3000,"x_m":-20.032,"y_m":712.055},{"altitude_m":186,"t_ms":4000,"x_m":-3.645,"y_m":537.692},{"altitude_m":186,"t_ms":5000,"x_m":12.125,"y_m":364.507},{"altitude_m":186,"t_ms":6000,"x_m":25.964,"y_m":192.456},{"altitude_m":186,"t_ms":7000,"x_m":38.212,"y_m":21.512},{"altitude_m":186,"t_ms":8000,"x_m":50.053,"y_m":-148.631},{"altitude_m":186,"t_ms":9000,"x_m":62.39,"y_m":-318.424},{"altitude_m":186,"t_ms":10000,"x_m":75.526,"y_m":-488.143},{"altitude_m":186,"t_ms":11000,"x_m":89.659,"y_m":-657.852},{"altitude_m":186,"t_ms":12000,"x_m":104.435,"y_m":-827.536},{"altitude_m":186,"t_ms":13000,"x_m":119.383,"y_m":-997.087},{"altitude_m":186,"t_ms":14000,"x_m":134.293,"y_m":-1166.417},{"altitude_m":186,"t_ms":15000,"x_m":149.223,"y_m":-1335.523}]},{"affiliation":"simulated_threat","entity_class":"uas","t_visible_ms":4000,"target_id":"threat-03","trajectory":[{"altitude_m":174,"t_ms":0,"x_m":-126.251,"y_m":1229.708},{"altitude_m":174,"t_ms":1000,"x_m":-119.155,"y_m":1047.828},{"altitude_m":174,"t_ms":2000,"x_m":-108.506,"y_m":867.467},{"altitude_m":174,"t_ms":3000,"x_m":-96.36,"y_m":694.224},{"altitude_m":174,"t_ms":4000,"x_m":-84.192,"y_m":526.181},{"altitude_m":174,"t_ms":5000,"x_m":-71.254,"y_m":358.922},{"altitude_m":174,"t_ms":6000,"x_m":-57.059,"y_m":189.217},{"altitude_m":174,"t_ms":7000,"x_m":-42.153,"y_m":16.676},{"altitude_m":174,"t_ms":8000,"x_m":-27.274,"y_m":-156.718},{"altitude_m":174,"t_ms":9000,"x_m":-12.922,"y_m":-328.803},{"altitude_m":174,"t_ms":10000,"x_m":0.711,"y_m":-498.84},{"altitude_m":174,"t_ms":11000,"x_m":13.774,"y_m":-667.459},{"altitude_m":174,"t_ms":12000,"x_m":26.727,"y_m":-835.722},{"altitude_m":174,"t_ms":13000,"x_m":40.024,"y_m":-1004.35},{"altitude_m":174,"t_ms":14000,"x_m":53.851,"y_m":-1173.495},{"altitude_m":174,"t_ms":15000,"x_m":68.125,"y_m":-1342.932}]},{"affiliation":"simulated_threat","entity_class":"uas","t_visible_ms":4000,"target_id":"threat-04","trajectory":[{"altitude_m":143,"t_ms":0,"x_m":-128.756,"y_m":1238.765},{"altitude_m":143,"t_ms":1000,"x_m":-132.853,"y_m":1068.772},{"altitude_m":143,"t_ms":2000,"x_m":-131.645,"y_m":902.782},{"altitude_m":143,"t_ms":3000,"x_m":-121.564,"y_m":735.202},{"altitude_m":143,"t_ms":4000,"x_m":-104.692,"y_m":565.251},{"altitude_m":143,"t_ms":5000,"x_m":-85.342,"y_m":394.879},{"altitude_m":143,"t_ms":6000,"x_m":-66.414,"y_m":225.559},{"altitude_m":143,"t_ms":7000,"x_m":-48.659,"y_m":56.973},{"altitude_m":143,"t_ms":8000,"x_m":-31.805,"y_m":-112.015},{"altitude_m":143,"t_ms":9000,"x_m":-15.458,"y_m":-281.994},{"altitude_m":143,"t_ms":10000,"x_m":0.649,"y_m":-452.734},{"altitude_m":143,"t_ms":11000,"x_m":16.466,"y_m":-623.5},{"altitude_m":143,"t_ms":12000,"x_m":32.126,"y_m":-793.792},{"altitude_m":143,"t_ms":13000,"x_m":47.896,"y_m":-963.531},{"altitude_m":143,"t_ms":14000,"x_m":63.883,"y_m":-1132.876},{"altitude_m":143,"t_ms":15000,"x_m":79.969,"y_m":-1302.025}]},{"affiliation":"simulated_threat","entity_class":"uas","t_visible_ms":4000,"target_id":"threat-05","trajectory":[{"altitude_m":137,"t_ms":0,"x_m":-136.329,"y_m":1171.411},{"altitude_m":137,"t_ms":1000,"x_m":-118.338,"y_m":1005.549},{"altitude_m":137,"t_ms":2000,"x_m":-103.159,"y_m":836.917},{"altitude_m":137,"t_ms":3000,"x_m":-89.564,"y_m":666.257},{"altitude_m":137,"t_ms":4000,"x_m":-77.262,"y_m":493.525},{"altitude_m":137,"t_ms":5000,"x_m":-65.178,"y_m":319.427},{"altitude_m":137,"t_ms":6000,"x_m":-52.342,"y_m":145.536},{"altitude_m":137,"t_ms":7000,"x_m":-38.274,"y_m":-26.594},{"altitude_m":137,"t_ms":8000,"x_m":-23.105,"y_m":-196.682},{"altitude_m":137,"t_ms":9000,"x_m":-7.227,"y_m":-365.583},{"altitude_m":137,"t_ms":10000,"x_m":8.916,"y_m":-534.436},{"altitude_m":137,"t_ms":11000,"x_m":25.013,"y_m":-703.751},{"altitude_m":137,"t_ms":12000,"x_m":41.035,"y_m":-873.322},{"altitude_m":137,"t_ms":13000,"x_m":56.976,"y_m":-1042.786},{"altitude_m":137,"t_ms":14000,"x_m":72.794,"y_m":-1211.969},{"altitude_m":137,"t_ms":15000,"x_m":88.458,"y_m":-1380.926}]},{"affiliation":"simulated_threat","entity_class":"uas","t_visible_ms":4000,"target_id":"threat-06","trajectory":[{"altitude_m":157,"t_ms":0,"x_m":-111.371,"y_m":1231.754},{"altitude_m":157,"t_ms":1000,"x_m":-79.613,"y_m":1058.859},{"altitude_m":157,"t_ms":2000,"x_m":-54.58,"y_m":884.99},{"altitude_m":157,"t_ms":3000,"x_m":-40.834,"y_m":712.06},{"altitude_m":157,"t_ms":4000,"x_m":-33.616,"y_m":542.622},{"altitude_m":157,"t_ms":5000,"x_m":-26.508,"y_m":376.594},{"altitude_m":157,"t_ms":6000,"x_m":-15.819,"y_m":211.657},{"altitude_m":157,"t_ms":7000,"x_m":-1.216,"y_m":46.045},{"altitude_m":157,"t_ms":8000,"x_m":15.499,"y_m":-120.659},{"altitude_m":157,"t_ms":9000,"x_m":32.541,"y_m":-288.142},{"altitude_m":157,"t_ms":10000,"x_m":49.203,"y_m":-455.835},{"altitude_m":157,"t_ms":11000,"x_m":65.425,"y_m":-623.583},{"altitude_m":157,"t_ms":12000,"x_m":81.321,"y_m":-791.533},{"altitude_m":157,"t_ms":13000,"x_m":96.96,"y_m":-959.877},{"altitude_m":157,"t_ms":14000,"x_m":112.396,"y_m":-1128.653},{"altitude_m":157,"t_ms":15000,"x_m":127.697,"y_m":-1297.723}]},{"affiliation":"non_hostile","entity_class":"balloon","t_visible_ms":4000,"target_id":"clutter-01","trajectory":[{"altitude_m":240,"t_ms":0,"x_m":-937.413,"y_m":-40.28},{"altitude_m":240,"t_ms":1000,"x_m":-814.077,"y_m":-59.329},{"altitude_m":240,"t_ms":2000,"x_m":-737.34,"y_m":-31.778},{"altitude_m":240,"t_ms":3000,"x_m":-623.735,"y_m":-41.096},{"altitude_m":240,"t_ms":4000,"x_m":-524.101,"y_m":-36.443},{"altitude_m":240,"t_ms":5000,"x_m":-434.551,"y_m":-21.706},{"altitude_m":240,"t_ms":6000,"x_m":-330.385,"y_m":-21.584},{"altitude_m":240,"t_ms":7000,"x_m":-234.764,"y_m":-12.919},{"altitude_m":240,"t_ms":8000,"x_m":-135.169,"y_m":-8.226},{"altitude_m":240,"t_ms":9000,"x_m":-40.276,"y_m":1.168},{"altitude_m":240,"t_ms":10000,"x_m":56.877,"y_m":8.302},{"altitude_m":240,"t_ms":11000,"x_m":157.723,"y_m":11.744},{"altitude_m":240,"t_ms":12000,"x_m":250.794,"y_m":22.96},{"altitude_m":240,"t_ms":13000,"x_m":367.789,"y_m":10.252},{"altitude_m":240,"t_ms":14000,"x_m":469.104,"y_m":13.225},{"altitude_m":240,"t_ms":15000,"x_m":546.668,"y_m":39.947}]},{"affiliation":"friendly","entity_class":"friendly_aircraft","t_visible_ms":5000,"target_id":"clutter-02","trajectory":[{"altitude_m":81,"t_ms":0,"x_m":1143.423,"y_m":-526.633},{"altitude_m":81,"t_ms":1000,"x_m":1013.15,"y_m":-462.151},{"altitude_m":81,"t_ms":2000,"x_m":898.433,"y_m":-413.226},{"altitude_m":81,"t_ms":3000,"x_m":773.579,"y_m":-354.162},{"altitude_m":81,"t_ms":4000,"x_m":657.046,"y_m":-303.42},{"altitude_m":81,"t_ms":5000,"x_m":530.8,"y_m":-242.965},{"altitude_m":81,"t_ms":6000,"x_m":409.727,"y_m":-187.683},{"altitude_m":81,"t_ms":7000,"x_m":288.289,"y_m":-132.036},{"altitude_m":81,"t_ms":8000,"x_m":166.622,"y_m":-76.16},{"altitude_m":81,"t_ms":9000,"x_m":44.799,"y_m":-20.127},{"altitude_m":81,"t_ms":10000,"x_m":-71.37,"y_m":30.251},{"altitude_m":81,"t_ms":11000,"x_m":-203.045,"y_m":96.134},{"altitude_m":81,"t_ms":12000,"x_m":-318.033,"y_m":145.332},{"altitude_m":81,"t_ms":13000,"x_m":-442.511,"y_m":204.019},{"altitude_m":81,"t_ms":14000,"x_m":-548.909,"y_m":244.626},{"altitude_m":81,"t_ms":15000,"x_m":-686.369,"y_m":316.296}]}],"time_step_ms":1000}
